{
  "$schema": "../schema/muhammad.schema.json",
  "version": 1,
  "lang": "de",
  "dir": "ltr",
  "translation": {
    "status": "machine",
    "from": "ar",
    "reviewedBy": null,
    "reviewedAt": null
  },
  "source": {
    "file": "Mohammed-historical-events",
    "generatedBy": "tools/build_content.py",
    "generatedAt": "2026-08-15"
  },
  "dateCaveat": "Der Hidschri-Kalender ist ein Mondkalender; ein frühes Hidschri-Datum lässt sich nicht so in ein gregorianisches umrechnen, als wäre es exakt aus einem festen Kalender berechnet worden. Moderne Quellen weichen in der Zuordnung voneinander ab. Die hier angegebenen gregorianischen Daten sind ungefähre Angaben.",
  "sources": [
    {
      "id": "worldhistory",
      "label": "Weltgeschichte Enzyklopädie / World History Encyclopedia",
      "url": "https://www.worldhistory.org/timeline/Prophet_Muhammad/"
    },
    {
      "id": "pbs",
      "label": "PBS — Muhammad: Legacy of a Prophet",
      "url": "https://www.pbs.org/muhammad/timeline_html.shtml"
    },
    {
      "id": "islamicchronicles",
      "label": "Muslim History Chronicles",
      "url": "https://islamicchronicles.com/islamic-history/rise-of-islam/chronological-biography-of-prophet-muhammad/"
    }
  ],
  "eras": [
    {
      "id": "pre-birth-and-childhood",
      "order": 1,
      "title": "I. Vor der Geburt des Propheten, seine Geburt und Kindheit",
      "firstEvent": 1,
      "lastEvent": 21
    },
    {
      "id": "prophethood-and-meccan-daawah",
      "order": 2,
      "title": "II. Der Beginn des Prophetentums und die mekkanische Verkündigung",
      "firstEvent": 22,
      "lastEvent": 50
    },
    {
      "id": "hijrah-and-medina",
      "order": 3,
      "title": "III. Die Hidschra und die Gründung der Gemeinschaft von Medina",
      "firstEvent": 51,
      "lastEvent": 74
    },
    {
      "id": "hudaybiyah-khaybar-and-beyond",
      "order": 4,
      "title": "IV. Al-Hudaibiya, Chaibar und die internationale Phase",
      "firstEvent": 75,
      "lastEvent": 84
    },
    {
      "id": "conquest-of-mecca",
      "order": 5,
      "title": "V. Die Eroberung Mekkas und die Zeit danach",
      "firstEvent": 85,
      "lastEvent": 92
    },
    {
      "id": "tabuk-and-the-completed-state",
      "order": 6,
      "title": "VI. Tabuk, das Jahr der Delegationen und die Vollendung des Staates",
      "firstEvent": 93,
      "lastEvent": 108
    }
  ],
  "events": [
    {
      "id": 1,
      "slug": "quraysh-and-mecca",
      "eraId": "pre-birth-and-childhood",
      "order": 1,
      "title": "Die Stellung der Quraisch und Mekkas",
      "summary": "Mekka war wegen der Kaaba und seiner Lage an den Handelsrouten ein bedeutendes religiöses und wirtschaftliches Zentrum. Die Quraisch besaßen großen Einfluss auf die Verwaltung der Pilgerfahrt und den Dienst am Heiligtum.",
      "date": {
        "hijri": "ca. 70–60 v. H.",
        "gregorian": "6. Jahrhundert n. Chr.",
        "sortYearHijri": -70,
        "sortYearGregorian": null
      },
      "authenticity": {
        "mark": "unmarked",
        "qualifier": null,
        "grade": null
      },
      "placeText": "Mekka",
      "locations": [
        "mecca"
      ],
      "movement": false
    },
    {
      "id": 2,
      "slug": "year-of-the-elephant",
      "eraId": "pre-birth-and-childhood",
      "order": 2,
      "title": "Das Jahr des Elefanten",
      "summary": "Abraha, der Herrscher des Jemen unter dem Königreich Aksum, entsandte ein Heer nach Mekka, um die Kaaba zu zerstören. Der Koran berichtet von den Gefährten des Elefanten; das Heer wurde vernichtet und erreichte das Haus nie.",
      "date": {
        "hijri": "ca. 53 v. H.",
        "gregorian": "570/571 n. Chr.",
        "sortYearHijri": -53,
        "sortYearGregorian": 570
      },
      "authenticity": {
        "mark": "verified",
        "qualifier": null,
        "grade": null
      },
      "placeText": "Mekka und Jemen",
      "locations": [
        "mecca",
        "yemen"
      ],
      "movement": false
    },
    {
      "id": 3,
      "slug": "death-of-abdullah",
      "eraId": "pre-birth-and-childhood",
      "order": 3,
      "title": "Der Tod von Abdullah ibn Abd al-Muttalib",
      "summary": "Nach der bekanntesten Ansicht starb der Vater des Propheten vor dessen Geburt. Er war zu einer Handelsreise aufgebrochen und erkrankte in Yathrib. So wurde der Prophet als Halbwaise geboren.",
      "date": {
        "hijri": "ca. 53 v. H.",
        "gregorian": "570/571 n. Chr.",
        "sortYearHijri": -53,
        "sortYearGregorian": 570
      },
      "authenticity": {
        "mark": "approximate",
        "qualifier": null,
        "grade": null
      },
      "placeText": "Medina / Mekka",
      "locations": [
        "medina",
        "mecca"
      ],
      "movement": false
    },
    {
      "id": 4,
      "slug": "birth-of-the-prophet",
      "eraId": "pre-birth-and-childhood",
      "order": 4,
      "title": "Die Geburt des Propheten ﷺ",
      "summary": "Er wurde an einem Montag im Jahr des Elefanten geboren. Der genaue Tag des Monats ist sehr umstritten; der 12. Rabi' al-Auwal ist der bekannteste, aber kein gesichertes Datum.",
      "date": {
        "hijri": "Rabi' al-Auwal, ca. 53 v. H.",
        "gregorian": "570/571 n. Chr.",
        "sortYearHijri": -53,
        "sortYearGregorian": 570
      },
      "authenticity": {
        "mark": "verified",
        "qualifier": null,
        "grade": "B"
      },
      "placeText": "Mekka",
      "locations": [
        "mecca"
      ],
      "movement": false
    },
    {
      "id": 5,
      "slug": "naming-muhammad",
      "eraId": "pre-birth-and-childhood",
      "order": 5,
      "title": "Seine Benennung als Muhammad",
      "summary": "Sein Großvater Abd al-Muttalib gab ihm den Namen Muhammad, der bei den Arabern jener Zeit weniger gebräuchlich war.",
      "date": {
        "hijri": "53 v. H.",
        "gregorian": "570/571 n. Chr.",
        "sortYearHijri": -53,
        "sortYearGregorian": 570
      },
      "authenticity": {
        "mark": "approximate",
        "qualifier": null,
        "grade": null
      },
      "placeText": "Mekka",
      "locations": [
        "mecca"
      ],
      "movement": false
    },
    {
      "id": 6,
      "slug": "nursing-with-halimah",
      "eraId": "pre-birth-and-childhood",
      "order": 6,
      "title": "Seine Stillzeit bei Halima as-Sa'diya",
      "summary": "Es war Brauch der Vornehmen Mekkas, ihre Kinder zugunsten der Sprachreinheit und einer gesünderen Umgebung in die Wüste zu geben. Halima as-Sa'diya von den Banu Sa'd nahm ihn auf, und er verbrachte seine frühe Kindheit bei ihr.",
      "date": {
        "hijri": "53–51 v. H.",
        "gregorian": "570–572 n. Chr.",
        "sortYearHijri": -53,
        "sortYearGregorian": 570
      },
      "authenticity": {
        "mark": "approximate",
        "qualifier": null,
        "grade": null
      },
      "placeText": "Mekka → Wüste der Banu Sa'd",
      "locations": [
        "mecca",
        "badiyat-bani-saad"
      ],
      "movement": true
    },
    {
      "id": 7,
      "slug": "first-splitting-of-the-breast",
      "eraId": "pre-birth-and-childhood",
      "order": 7,
      "title": "Die erste Öffnung der Brust",
      "summary": "In Sahih Muslim und anderen Werken wird überliefert, dass Gabriel ihm als Kind die Brust öffnete, sein Herz wusch und reinigte und es dann wieder einsetzte.",
      "date": {
        "hijri": "ca. 49 v. H.",
        "gregorian": "ca. 574 n. Chr.",
        "sortYearHijri": -49,
        "sortYearGregorian": 574
      },
      "authenticity": {
        "mark": "verified",
        "qualifier": "was den Ursprung der Überlieferung betrifft",
        "grade": null
      },
      "placeText": "Wüste der Banu Sa'd",
      "locations": [
        "badiyat-bani-saad"
      ],
      "movement": false
    },
    {
      "id": 8,
      "slug": "return-to-his-mother",
      "eraId": "pre-birth-and-childhood",
      "order": 8,
      "title": "Seine Rückkehr zu seiner Mutter",
      "summary": "Nach der Stillzeit bei den Banu Sa'd kehrte er zu seiner Mutter Amina zurück.",
      "date": {
        "hijri": "ca. 47 v. H.",
        "gregorian": "ca. 576/577 n. Chr.",
        "sortYearHijri": -47,
        "sortYearGregorian": 576
      },
      "authenticity": {
        "mark": "approximate",
        "qualifier": null,
        "grade": null
      },
      "placeText": "Wüste der Banu Sa'd → Mekka",
      "locations": [
        "badiyat-bani-saad",
        "mecca"
      ],
      "movement": true
    },
    {
      "id": 9,
      "slug": "aminah-visits-medina",
      "eraId": "pre-birth-and-childhood",
      "order": 9,
      "title": "Aminas Reise nach Medina",
      "summary": "Amina reiste mit dem Propheten, um seine mütterlichen Verwandten von den Banu an-Naddschar zu besuchen, und kehrte mit ihm zurück.",
      "date": {
        "hijri": "ca. 47 v. H.",
        "gregorian": "ca. 577 n. Chr.",
        "sortYearHijri": -47,
        "sortYearGregorian": 577
      },
      "authenticity": {
        "mark": "approximate",
        "qualifier": null,
        "grade": null
      },
      "placeText": "Mekka → Medina",
      "locations": [
        "mecca",
        "medina"
      ],
      "movement": true
    },
    {
      "id": 10,
      "slug": "death-of-aminah",
      "eraId": "pre-birth-and-childhood",
      "order": 10,
      "title": "Der Tod von Amina bint Wahb",
      "summary": "Seine Mutter starb in al-Abwa, als er etwa sechs Jahre alt war; damit war er Vollwaise.",
      "date": {
        "hijri": "ca. 47 v. H.",
        "gregorian": "ca. 577 n. Chr.",
        "sortYearHijri": -47,
        "sortYearGregorian": 577
      },
      "authenticity": {
        "mark": "verified",
        "qualifier": null,
        "grade": null
      },
      "placeText": "Al-Abwa",
      "locations": [
        "al-abwa"
      ],
      "movement": false
    },
    {
      "id": 11,